{
  "strategy_id": "sweep_841eba65-0_3",
  "strategy_version_id": "sweep_841eba65-0_3",
  "version": 1,
  "name": "Pullback in Uptrend Entry Composite [ATR Multiplier=3]",
  "description": "Composite entry indicator for buying pullbacks in an uptrend using MACD divergence and regime filter.",
  "status": "testing",
  "asset_class": "stocks",
  "interval": "1d",
  "universe": [],
  "structure_config": {
    "swing_method": "rdp",
    "swing_epsilon_pct": 0.05
  },
  "setup_config": {
    "pattern_type": "pullback_uptrend_entry_composite",
    "composite_spec": {
      "intent": "entry",
      "stages": [
        {
          "id": "timing",
          "pattern_id": "macd_divergence_primitive_v2",
          "params": {
            "divergence_type": "bullish"
          }
        },
        {
          "id": "regime",
          "pattern_id": "regime_filter",
          "params": {
            "reference_symbol": "SPY",
            "required_regime": "expansion"
          }
        }
      ],
      "reducer": {
        "op": "AND",
        "inputs": [
          "timing",
          "regime"
        ]
      }
    }
  },
  "entry_config": {
    "entry_type": "market_on_close"
  },
  "risk_config": {
    "stop_type": "atr_multiple",
    "atr_multiplier": 3,
    "take_profit_R": 4,
    "max_hold_bars": 30
  },
  "exit_config": {},
  "cost_config": {
    "commission_per_trade": 0,
    "slippage_pct": 0.001
  },
  "execution_config": {},
  "created_at": "2026-02-22T03:35:40.297Z",
  "updated_at": "2026-02-22T03:47:45.615Z",
  "spec_hash": "309d63fc910568bc189993acaf1a3166edd38ac057f08e98d16221ff6b329ff9",
  "parameter_manifest": [
    {
      "key": "swing_epsilon_pct",
      "label": "RDP Epsilon %",
      "path": "structure_config.swing_epsilon_pct",
      "anatomy": "structure",
      "type": "float",
      "identity_preserving": true,
      "sweep_enabled": true,
      "sensitivity_enabled": true,
      "suggested_values": [
        0.01,
        0.02,
        0.03
      ],
      "min": 0.01,
      "max": 0.15,
      "step": 0.01,
      "priority": 100,
      "failure_modes_targeted": [
        "high_sensitivity",
        "low_trade_count"
      ]
    },
    {
      "key": "required_regime",
      "label": "Required Regime",
      "path": "setup_config.composite_spec.stages.1.params.required_regime",
      "anatomy": "regime_filter",
      "type": "enum",
      "identity_preserving": true,
      "sweep_enabled": true,
      "sensitivity_enabled": false,
      "suggested_values": [
        "expansion",
        "neutral",
        "contraction"
      ],
      "priority": 60,
      "failure_modes_targeted": [
        "high_drawdown"
      ]
    },
    {
      "key": "atr_multiplier",
      "label": "ATR Multiplier",
      "path": "risk_config.atr_multiplier",
      "anatomy": "stop_loss",
      "type": "float",
      "identity_preserving": true,
      "sweep_enabled": true,
      "sensitivity_enabled": true,
      "suggested_values": [
        0.75,
        1,
        1.25
      ],
      "min": 0.75,
      "max": 3,
      "step": 0.25,
      "priority": 95,
      "failure_modes_targeted": [
        "high_drawdown"
      ]
    },
    {
      "key": "take_profit_R",
      "label": "Take Profit R",
      "path": "risk_config.take_profit_R",
      "anatomy": "take_profit",
      "type": "float",
      "identity_preserving": true,
      "sweep_enabled": true,
      "sensitivity_enabled": true,
      "suggested_values": [
        1.5,
        2,
        2.5
      ],
      "min": 1.5,
      "max": 14,
      "step": 0.5,
      "priority": 95,
      "failure_modes_targeted": [
        "high_drawdown",
        "high_sensitivity"
      ]
    },
    {
      "key": "max_hold_bars",
      "label": "Max Hold Bars",
      "path": "risk_config.max_hold_bars",
      "anatomy": "take_profit",
      "type": "int",
      "identity_preserving": true,
      "sweep_enabled": true,
      "sensitivity_enabled": true,
      "suggested_values": [
        13,
        14,
        15
      ],
      "min": 13,
      "max": 90,
      "step": 1,
      "priority": 85,
      "failure_modes_targeted": [
        "high_drawdown",
        "high_sensitivity"
      ]
    },
    {
      "key": "max_concurrent_positions",
      "label": "Max Concurrent Positions",
      "path": "risk_config.max_concurrent_positions",
      "anatomy": "risk_controls",
      "type": "int",
      "identity_preserving": true,
      "sweep_enabled": true,
      "sensitivity_enabled": true,
      "suggested_values": [
        1,
        2,
        3
      ],
      "min": 1,
      "max": 20,
      "step": 1,
      "priority": 60,
      "failure_modes_targeted": [
        "high_drawdown"
      ]
    }
  ]
}